{
  "freq": "MS",
  "target": "y",
  "horizon": 12,
  "min_history_periods": 18,
  "static_features": ["segment", "region"],
  "historic_exog": ["calls"],
  "future_exog": ["active_clients", "bizdev_id"],
  "categorical_features": ["segment", "region", "bizdev_id"],
  "lags": [1, 3, 6, 12],
  "lag_transforms": {
    "1": [
      { "name": "rolling_mean", "window_size": 3 },
      { "name": "rolling_mean", "window_size": 6 }
    ]
  },
  "date_features": ["month", "quarter"],
  "target_transforms": [
    { "name": "Differences", "args": [[1]] }
  ],
  "gap_policy": "error",
  "lightgbm_params": {
    "n_estimators": 200,
    "learning_rate": 0.05,
    "num_leaves": 31,
    "max_depth": -1,
    "min_data_in_leaf": 5,
    "objective": "regression",
    "metric": "mae",
    "verbosity": -1
  },
  "calibration": {
    "n_windows": 5
  }
}
